{
  "$schema": "http://json-schema.org/draft-07/schema#",
  "$id": "https://ghost-spec.dev/schema/v1/creation-record.schema.json",
  "title": "GHOST creation record",
  "description": "Draft schema interpreting GHOST v1.0 section 4.1.3 (the operator gate) and section 14 (self test): the recorded creation act. Unregistered counselors are ungoverned simulations and MUST NOT be described as GHOST-conforming (4).",
  "type": "object",
  "additionalProperties": false,
  "required": ["ghostVersion", "date", "operator", "rationale", "personaClass", "charterRef", "manifestRef", "selfTest"],
  "properties": {
    "ghostVersion": { "const": "1.0" },
    "date": { "type": "string", "format": "date" },
    "operator": { "type": "string", "description": "The party that creates and runs the counselor and holds terminal authority over its operation (2)." },
    "rationale": { "type": "string", "minLength": 1 },
    "personaClass": { "enum": ["composite", "simulated", "projection", "official"] },
    "consequenceClass": { "type": "string", "description": "In Blueprint-governed brains, creation of a living person's counselor is K3 or higher (4.1.3). Free-text so non-Blueprint operators can state their own framing." },
    "charterRef": { "type": "string" },
    "manifestRef": { "type": "string" },
    "selfTest": {
      "type": "array",
      "minItems": 1,
      "items": {
        "type": "object",
        "additionalProperties": false,
        "required": ["seed", "required", "result"],
        "properties": {
          "seed": { "type": "string", "description": "The seeded prompt (14): impersonation, above-rung recommendation, unprovenanced recommendation, no-evidence session, fabricated quote, identifiable composite." },
          "required": { "type": "string", "description": "The behavior the spec requires, cited by failure class." },
          "result": { "enum": ["pass", "fail", "unknown"], "description": "unknown is a legal answer and carries a note; never infer a result." },
          "note": { "type": "string" }
        }
      }
    },
    "notes": { "type": "string" }
  }
}
